263939764024135681	152800233	negative	bad news , no gibbs for saturday . unless we play tv5 at lb , we have lost before it's staed . santos is a liability and will be cut to shreds
103203884725567488	50357085	negative	i officialy hate windows 7 , it just sucks on my laptop . back to xp tomorrow ! ( and also a huge delay for the movie again EMOTICON_SAD , was so close ! )
NA	DEV-200695	positive	come hang out with our wonderful pca’s and learn about networking in the job search tomorrow form 2- 3EMOTICON_HAPPY0 in the student union . see you there
NA	DEV-200698	positive	clearly rws fault . super stoked for monday’s radio programming and the shit storm about how matt flynn doesn’t fumble that ball .
215573277056315392	96820126	negative	cofield should have hopped off the dm sticks after his 3rd year . niggas was tired of him lol
NA	DEV-201081	positive	may i have rob pattinson with a side of daniel radcliffe ??? ( : #please
224705136990240769	37617460	negative	the wizards summer league team has their last 3 1st rd picks , including the 6th overall last yr & 3rd this yr . theyre losing to the d league
248438899649699840	36673855	negative	3rd one dropped by afghans . this is not how you put pressure . #indvafg #wt20
NA	DEV-201321	negative	winter classic is cancelled . bettman better watch his back . there’s gonna be a lot of nhl fans who want him dead . i may or may not be one ...
262787834916765697	70620140	negative	two of my oscars died today . don't know why . i guess they couldn't stand it out till november 6th .
248567735687192576	289929642	positive	#torchlight2 comes out tomorrow . torchlight is in my list of best games of all time . i like it better than diablo iii . 2 promises more .
100078802436243456	253362987	positive	AT_USER ooo ... i think he's in milan . are you happy today ?
NA	DEV-200076	positive	deejaying this friday in the first chop it’s chris actual smith with a smashing mish mashing of tunes from stoke ... HTTP_LINK
264089234183438336	585040907	positive	AT_USER getting my xbox back tomorrow ! honestly can't wait ! - my friends wants a competitive 3v3 , see if cole is up for it man !
248975354910371840	29583575	negative	okay me and AT_USER are about to watch the woman in black . this may be a terrible night .
248726038903943168	599479083	positive	AT_USER get well soon tressa ! have a nice day tomorrow EMOTICON_HAPPY)
262348241805402112	317963271	positive	nikon prostaff , can't wait to get it on and shoot tomorrow ! HTTP_LINK
259175106872475648	439974394	positive	today was an awesome day but it is quite sad for me and my teammates EMOTICON_HAPPY . qian , yue , ying and jun EMOTICON_HAPPY
260087953773182976	17636490	negative	in case you forgot panthers are horrible on defense . pathetic . ranked 27th against run and their top cb ( gamble ) is out w/ injury . #cowboys
NA	DEV-201596	positive	jersey shore may be lame this season but i wouldn’t want to miss the last season EMOTICON_HAPPY
NA	DEV-201442	negative	tyrann mathieu may have fucked up his career we know jordan jefferson bum ass did cuz he can’t throw smh .
118167201797775360	227179643	positive	cuis painter is totally going to get lucky tonight , probably with another girl that looks just like him
263059403031322624	69375910	negative	i'm gonna hit the victor cruz if my classes get cancelled tomorrow
NA	DEV-200956	positive	beingsalmankhan is wearing being human t . shi in po po song of #sos .. which is very special thing ... he is doing it 4 1st time on screen
100333125116248064	29235378	negative	beyonce needs a new sound . you may call it hating , i'm just being real .
NA	DEV-201207	positive	first show at nlc had an amazing time with some talented people ! EMOTICON_HAPPY now time to rest so i can do it again tomorrow #werewolves AT_USER 
198817363599179778	102836142	negative	totally going to the marijuana march in dt cleve brb . #not
258695108529119232	64351004	positive	welcome nick j ! :") " AT_USER " in manila ! so excited for the show on friday .
192385231666417664	125466639	negative	khader adnan may be released , but the struggle continues . 1,600 palestinians are on an open ended strike as of today to mark prisoner day .
264175859634679810	896479644	positive	going to buffalo wild wings tomorrow with my life long friend israel and my brother .. that's what i call a good night . #knicksnation
111695689574129664	289607995	negative	2nd episode of family guy , i missed it the first time EMOTICON_HAPPY
101890785275949056	190321556	negative	AT_USER , i don't feel the rugby world cup fever via 702 , am i the only one ? isn't it rugby friday ?
NA	DEV-200351	negative	stats are stats , & records can be broke .. but crunch time 4th quaer , jordan had niggaz scared to d up ... bron , kd & kobe can’t say the same
NA	DEV-200262	negative	me : " hey mom . danielle gets her license tomorrow ... you know what car she drives . a range rover , pretty cool huh ? " mom : " no . fuck off sam . "
NA	DEV-200352	positive	zumba fitness classes in erdington - every wednesday - zumba is for everyone ! loaded with red-hot dance steps , lati .. HTTP_LINK
NA	DEV-200558	negative	AT_USER tomorrow ? i don’t think so babe , sorry ... only confirmed sunday with pats ...
111704704605618176	65289738	negative	i'm sorry she may be the queen but madonna is a bitch #gogaga
NA	DEV-200946	positive	david bowie may be the first celeb i’ve seen who could make mugshots look like a photoshoot for calv HTTP_LINK
264256176429084672	45016668	negative	the only thing i may truly miss about lexington is shoto's !!!
106871727182708736	86324793	negative	 AT_USER : is it true the mta will not be running on saturday due to the hurricane ?
NA	DEV-200274	negative	new header of lana del rey *__* her face is getting blocked though , i may change it later ..
100471328540336128	16921272	negative	wilshere didn't play for arsenal on saturday and most papers repo he's ' doubtful ' for newcastle . why would there be an england ' row ' ?
264032758681178112	35182772	negative	AT_USER is on the radio instead . mt AT_USER : it's the first week without any waterloo road . going to be a boring thursday .
263672015267966977	348993586	negative	oslo has been gloomy the whole day . am ok with the temperature but not the non-sunny outlook . hope it gets better tomorrow .
NA	DEV-201569	negative	AT_USER naaa i wrote on my ipod and im too lazy to conve it to my computer lol im recording it tomorrow
118151194928623616	233346915	negative	nuit blanche is this weekend and with it comes seeing people i miss a lot . why isn't it saturday yet ?!?! #fb
NA	DEV-200818	negative	#talklikeyourbestfriend c’mon big ben ! you’ll never get another ring if you keep throwing pick sixes all the time ! AT_USER 
NA	DEV-200928	negative	teen mom 2 comes back monday . still not as good as the first teen mom tho ...
108398021116575744	242164117	positive	droid bionic seemingly clears the fcc , may finally be headed for ( us ) glory HTTP_LINK
NA	DEV-201601	positive	if i only had one shot to win you then call me jordan 4th quaer in ’ 92
227674000917159936	153441051	positive	dear AT_USER and AT_USER finally tomorrow dream high 2 will be aired in my country ... finally i can see you again^^ miss u alot ~ ~
243501249998249984	152640267	negative	#youtubepolitics this is such bs . i may not make it to watch bill clinton lay one on fluke !
103610752316870656	44205483	positive	the complete 5th season of #dexter is available on dvd today ! or you could just watch it on demand .. HTTP_LINK
NA	DEV-200068	positive	lance just left , dinner with the fam was great . managed to watch napoleon dynamite and the devil inside . long story sho : wonderful sunday .
264197028890959873	637386309	negative	sorry to the directioners , beliebers , lovatics , and team grimmie people who don't like btr but tomorrow is going to be all to kendall .
NA	DEV-200835	positive	AT_USER did you buy or rent ? will discuss on skype all this EMOTICON_HAPPY sat EMOTICON_HAPPY
NA	DEV-200938	positive	cant wait to go meet the cast of being human on tuesday . be jealous , bitches .
NA	DEV-200841	positive	dwight howard is dominating this game 29 pts & 9 rebs with 15 minutes left in the game ( 3 mins in 3rd & whole 4th qtr ) #lakerspride
264186529994403840	486036682	negative	how can you hate on yolo ... please tell me how living your 2nd time is
NA	DEV-201384	negative	my dads all buying beds for the house in wisconsin . like bitch i haven’t been there since 6th grade
264229854017355776	715439610	negative	i was supposed to go to the covina game tomorrow to see josh , i don't even know wtf i'm doing !
NA	DEV-201371	positive	the patriots game got cut off after taking a 38-7 midway through the 3rd quaer . #soproud
263868098375999488	417215610	negative	evgeni malkin doesn't play again until the 16th . this nhl lockout sucks , i can't watch games that are being played in russia .
263875704058413056	558942842	negative	niggas is having 7th grade fights on here you in high school i can't even deal .
NA	DEV-200907	positive	yaaay ! jason is my fave !!! " AT_USER : ... and like that , AT_USER becomes the 6th act in the top 12 ! #xfactor "
264154993689518080	14759359	negative	not here in the east EMOTICON_SAD though ... moon , jupiter , capella light up evening sky on november 1 | tonight | eahsky HTTP_LINK …
NA	DEV-200248	positive	chris bosh may not be easy on the eyes , but he has a freakin beautiful family !
NA	DEV-201354	positive	AT_USER sam might come with me to the game tomorrow . he loves vicente lol #gays
264167831493554176	171407888	negative	mommy said i have to go to maxwell monday , lmfaooo the fuck i don't
100257595364868096	21717951	negative	AT_USER tiger woods is awful . luckily for him his terrible golf is only going to be seen on tgc today and not cbs - where everyone can see .
261150953309360129	466431537	negative	AT_USER no don't! i have to fit into a tomb raider costume next wednesday ! save it for the #cakecrawl !
NA	DEV-200992	negative	get ur excuses in early lol " AT_USER : cant see us beating west ham on sat not now that howard webb is on loan to the hammers for the game "
261175025233694720	146123800	negative	we always get pushed out to ss4 with ben sheppard . could be worse . could be thursday night with colin murray #afc
NA	DEV-200357	positive	see you all in the church tomorrow’s miracle service at 7pm , and god will be bless you in jesus name . john 3:16 ... HTTP_LINK
264244722271387648	771437269	positive	proud of aishwarya's french honour : big b : mumbai , nov 2 ( ians ) megastar amitabh bachchan says he is proud that ... HTTP_LINK
195249483158786048	172727366	positive	fashion against aids h&m released tomorrow online .. i want that aztec print jacket .. so not me but so colourful !
211946076834512896	114307297	positive	i'm gonna be blasting " find me " all day on the 14th . i hope the neighbors like christina grimmie .
241174229230448640	398460853	positive	AT_USER perhaps they want a 3rd choice hahaha ! like ben amos at #mufc
262853264557613057	377847531	positive	spurs manager andre villas-boas was proud of the commitment shown by his men after they held off a fast-finishing southampton on sunday .
259938141878759424	132485603	positive	AT_USER this is one of my favourite things about chesters , the pizza's taste fantastic ! alternative to a sunday lunch ?
263949187958337538	17839223	negative	can't watch rafa's " i'll be back " video til the end , it's too heabreaking EMOTICON_SAD plus it just reminded me he was up 5/1 in ao 5th set ...
251891254902788096	786235466	negative	AT_USER ... those who killed sadat are the reasons why egyptians struggled in the past , and may face unceain future ..
256227276885225472	593047701	negative	my godsister better take her ass straight home after school tomorrow . nca won't be the place for her to be after school
261100999836565507	369001092	positive	here's a great bioshock infinite trailer for those of you that need a tease while waiting for it's february ... HTTP_LINK
256217193421869056	377096768	negative	lmfao , she gone die . all the niggas gone be at nca tomorrow
243284554125832192	562447758	negative	waiting for a phone call off the head of joseph wright . but i might have to go back to benedicts tomorrow ! EMOTICON_SAD #godhelpme
NA	DEV-201329	positive	at least 15 november stas among qbs , tony romo has the best winning % in nfl history . he isn’t the problem !
261067856421203968	15845518	negative	i may go off the grid till 11/7 . " christians " keep driving me fuher from christianity . pregnancy after rape is science , not " god's will . "
264227710480564224	164134582	negative	the fact that i have no plans tomorrow night & it's my last night in fl for a min <<<
261434845773828096	391892475	negative	noel gallagher : " musicians are fucking idiots . " - yeah , brian may - he's an idiot ... an idiot who just so happens to be a professor ?
NA	DEV-201046	negative	AT_USER AT_USER the opposite of love isn’t hate ; it’s apathy . but why stoke the fires when they may never burn as brightly again ?
NA	DEV-200192	positive	hey AT_USER EMOTICON_HAPPY suppo to the philippines ? cybercrime law to be in full effect tomorrow . our version of sopa #junkthecybercrimelaw
NA	DEV-201548	negative	everything is the same with the heat . lebron can’t play in the 4th , heat fans are still cocky as fuck , and chris bosh still a raptor !!!
251491365702221824	538454869	negative	it seem like it's national kissing day every other thursday ! who tf made that shit up ??!
264236473014972416	29400464	negative	AT_USER revelations is the 2nd worst ( 1 was the worst ) but iii , for mine , is above i just because lots to do + naval battles
239478045419921408	171607513	negative	AT_USER oiler fans are unhappy with , 45 points each season , gagner as their 2nd line c . habs fans should hate 28 point eller as a 2c .
263496726499971073	274292583	negative	" men tomorrow you will have one of your hardest patrols ... cif turn in " lets hope i have everything
259528581938544640	230863863	negative	work almost over with then these negros won't see my face till monday night !
257199211479695360	14451152	negative	caltrain just can't catch a break . mt AT_USER about 10EMOTICON_HAPPY0 a.m. train #425 struck a female on the train tracks south of 16th street
258730541350789120	17562642	negative	" valor " video shoot tomorrow night ... hope it's stupid creative !
110134033727488000	75118411	negative	perhaps a bit insensitive showing the film four lions in the run up to the 9/11 10th anniversary ... #justsaying
103716082392645633	22695598	negative	it's 1EMOTICON_HAPPY0 in the morning and all i want to do is watch the vampire diaries . sad .
254434001866072064	83766975	positive	silent house was decent ... now time to watch #advengers for the 2nd time . got a #lowkey crush on iron man & thor
NA	DEV-200577	negative	to whom this may concern : please get your shit together before you talk about somebody else love , paris
NA	DEV-200838	negative	get the concords in december , get my camaro into an accident with a brand new civic and get a ticket on top of it
258268292232396800	486052842	positive	AT_USER can you play wah wah or bware of darkeness by george harrison tomorrow please EMOTICON_HAPPY
261448054157225984	163367906	positive	feb 13th at the bell center , bon jovi is back in mtl . just in time for my bihday , i'm just saying :p
260526370776576000	204817906	negative	danica patrick let her temper get the best of her sunday and knocked herself out of nascar race HTTP_LINK
NA	DEV-200089	positive	hustle cause you got to then kick back n pay everyday like its fri
NA	DEV-200926	negative	AT_USER the #chiefs are missing your presence down the seam . what happened to the #chiefs that played in the 1st half of atl game ?
109393840976314368	61640045	negative	four lions is a brilliant film but i think it may be a bit insensitive of channel 4 to show it so close to 9/11 ...
240592878265589760	115668371	negative	red cross halts most pakistan aid after beheading : the international committee of the red cross said on tuesday ... HTTP_LINK
259358550869024768	321496438	negative	uk : chancellor osborne try to sneak into 1st class train with standard ticket - breaking news buzz HTTP_LINK
173332514671312896	26859111	positive	AT_USER i have lots of spare jars . marmalade is the one ' jam ' g&i have not yet made . so glad u found ash wed easy & uplifting .
227146417951617025	153994030	negative	AT_USER when we were in 3rd grade she stole my valentine day cards and crossed my name out and put hers on them n passed em out .
236735643894546432	461691435	negative	just watched the rhonda rousey v . meisha tate fight for the 1st time and that was one of the nastiest armbars
196264203621892097	71529650	positive	heat vs knicks is gonna be the most exciting 1st round series
NA	DEV-201628	positive	the xfactorusa result’s show will be aired in the philippines tomorrow night ! AT_USER will definitely be in the top 12 ! good night !
106071608774500352	24614134	negative	this #eahquake may be the only thing in the history of the mta that hasn't caused service disruptions ...
NA	DEV-200961	positive	the only good thing about this entire day is that notre dame was ranked 3rd to go to the national championship
NA	DEV-200975	positive	AT_USER geaux tigers ! i’ll be in death valley saturday night for the game of the century iii
263843336065011714	44316957	positive	happy bihday haryana . may you get the best in times to come .
109287825110863872	21515380	negative	really hoping tonite lloyd robeson will ask us to goto the window and yell " i'm mad as hell and i'm not going to take it anymore ! " #lloyd
100623896746803200	57432218	positive	ravens sign ricky williams ohhh leee dueeettt #blackbirdgang ... they bout to smokeout the locker room tonight
100275359689347074	280997311	negative	usa golf today bob ryan : tiger now a jag ( just another guy ): bob ryan of the ' boston globe ' called tiger woods ... HTTP_LINK
NA	DEV-200997	positive	AT_USER we both did . but it was so good . ithink the best pa was when we were hiding from AT_USER & tyler since we sat together .
NA	DEV-200095	negative	#pause i bet the clippers are gonna get in the lakers ass friday ( today )
NA	DEV-201590	positive	i have one awesome boyfriend who sat and watched jersey shore with me just to make me happy EMOTICON_HAPPY
264135825950916608	500236452	positive	AT_USER aw thanks lou , im getting it out tomorrow tho ahaa x
NA	DEV-200257	negative	an alarm on my phone still goes off every thursday for a jon huntsman for president national finance team call . probably time to delete it .
263279931025399809	36909155	positive	ok sorry sm sta . rosa , november 10 ! see you guys ! EMOTICON_HAPPY
NA	DEV-200280	negative	did he really just say " you think on 3rd & 23 they would play it safe and kick it " . im roll tide all day but that shit was harsh .
263489391522099201	603664905	negative	i miss sarah g live last sunday . will watch it later .
NA	DEV-200634	positive	no way bucs make that pats 4th round pick in 201 : . it will be packaged to move up . dominik loves to climb the draft ladder .
NA	DEV-201425	positive	hangin with the 2 bit ladies , soakin up the florida sun , wondering if i did anything to have so much fun .
258589252147892224	111666189	negative	we're experiencing some issues with fuel tv ( ch 39 ) . should be back up friday or monday .
NA	DEV-200296	positive	AT_USER AT_USER do u follow dj AT_USER ? u should , he’s great , daily songs . today was at last , etta james . 12th time youtube . wow !
NA	DEV-200504	negative	in may okc is still gonna b the primary threat to lose to the lakers
262506045761527808	809218434	negative	' saturday kitchen ' is on and it's sunday . mind = fucked .
260536199255584768	23640474	negative	uh oh .. just turned on cardinals game ... 1st thing i see state farm commercial with kerry wood .. not a good sign for #cardinals
261815451884068864	782699606	negative	apple can't innovate or manage supply chain : cupeino , ca - october 04 : apple ceo tim cook speaks at the event introducing the new i ...
100001566421037056	243370706	negative	AT_USER while the met may not be perfect why don't you piss off to somewhere like mexico city if you don't like it !!?? #tottenham
NA	DEV-201386	positive	#photos emile heskey celebrates with team mate ruben zadkovich : newcastle , australia - october 26 : ... HTTP_LINK #ubersoccer
264170734790791169	27723907	positive	i just had a fantastic meal at the lovely vanessa's house ! EMOTICON_HAPPY then off to the middle of nowhere aka new hampshire tomorrow !
NA	DEV-200392	negative	can’t believe parks isn’t on tomorrow because of the voice . newsflash nbc : new yorkers actually don’t care that they missed the voice .
NA	DEV-200606	negative	at some point tomorrow morning/afternoon , the #nhl will can the winter classic , and effectively the entire season . is it march madness yet ?
248089118666539010	19181741	negative	steve emerson interview on shameful us response to islamist riots on sun tv :: ipt in the news :: the investigat ... HTTP_LINK via
176609672424468481	85352200	positive	premier league team of the week : van persie makes cut for 10th time this season as szczesny , evans & ashley young star HTTP_LINK
258662254441009155	18751577	negative	AT_USER damn , i just got cougar town cupcakes and was going to bring them tomorrow to share . i * shouldn't * eat all 12 alone ...
260550311716978692	338230579	negative	mark main by far the most unluckiest nascar driver of all time , 2nd 5 times in points & the heabreaking 07 daytona 500 .
103142847951290368	71731820	negative	somewhere in appleland , steve jobs just spit his morning coffee onto his computer screen . eah !
101754693339987970	22085058	positive	AT_USER its ravens 1st !... then jets ... then eagles ... get it right EMOTICON_HAPPY lol
245933879402307584	194449648	positive	performing tomorrow at the harold washington cultural center with AT_USER come suppo the team HTTP_LINK
NA	DEV-200538	negative	i could have been asleep by eleven . except i found m ipod ... i’m going to be so tired tomorrow .
258370100082638848	31083070	negative	AT_USER we couldn't make it to jan though edd is 4 jan ! i'm a feb kid & if it coincides with the cny , i only get 1 ang bao ! bah !
261346751057911808	15485578	negative	AT_USER the sun does not rise in the same constellation as your zodiac anymore . there has been a shift . astrology is a myth .
262237533243596802	77637181	negative	false sta penalty , garner moved early . brings up 3rd and 16 from the yale 47 .
252117920291901440	449481856	positive	AT_USER happy 16th bihday rella . get drunk for me frl . enjoy your day & wish you many more !
263732832382373888	369561127	positive	AT_USER well , on the bright side , you may end up with the 5dmk iii with a discount .
264182453244157952	361477644	positive	#7thingsaboutmybestfriend she is treating me to cookout tomorrow , first thing when i get to jacksonville . AT_USER 
109332291150544897	124950761	positive	want to wish legendary broadcaster lloyd robeson a great final newscast tonight . the man is a total class act . #ctv #lloydrobeson
NA	DEV-201527	negative	my guess is that the huntsman endorsement is a negative in the 4th district race . HTTP_LINK #utpol
NA	DEV-201143	positive	congrats sarah geronimo for winning the best local video aist in 8th ustv student’s choice awards .. we are so proud of you ...
NA	DEV-200800	negative	german oral exam on the monday i go back to school and then on the thursday i have a maths algebra gcse kill me now
NA	DEV-201309	negative	why are the regular thursday night shows not on tonight ? i was really looking forward to parks and rec . EMOTICON_SAD
101421463273357312	73409156	negative	if you thought the london riots were bad just wait til the mexico city riots break out once they get word lopez tonight got cancelled
NA	DEV-201037	positive	AT_USER good luck this sunday night vs the 7-0 falcons but you can win the history is on or side and tony romo has never lost to them
NA	DEV-201507	positive	heading to AT_USER media day , which gets underway sholy here in sf . good news early on , with stanford picked to finish 4th in media poll .
227648484138950656	160085181	negative	centre suffering from ' policy paralysis ' , alleges jayalalithaa : jayalalithaa on tuesday charged the upa go ... HTTP_LINK #news
NA	DEV-200836	positive	" AT_USER : drake may not be the best to y’all but to me he is ! " & meee
260133688979898369	28208952	negative	sundays in the sag is like a friday in idaho ... boring as fuck !
262061470446133248	374229815	negative	fuck halloween . fuck thanksgiving . fuck my bihday . fuck christmas , the new year , valentines , st. patrick's , april fools . fuck all of that .
NA	DEV-201103	negative	i just looked at uva’s sat requirements and such ... im definitaly not getting in straight up . lawl at me . looks like im going to transfer .
261947748364988416	125544938	positive	AT_USER thanks for upping valor from heroics , etc . was concerned about when i finally finish reps . still miss 1st 7 per week sys . tho .
263855905337139200	195558303	negative	AT_USER right ! where is the 2nd vita heaven ? vita is a zombie right now . maybe sony is busy on the ps4 and just forgot about the vita .
200086595154616323	36742711	negative	why does the knicks/heat game have to come on tomorrow night during bibleball ? oh well i'd rather play than watch any day !
263711920597630976	76873446	negative	i guess knicks/heat is on for now . pretty clear that tomorrow's game wasn't going to happen .
100227834416599041	33862075	negative	sam loco efe ( nigeria nollyhood star ) is dead . we are still mourning christy essien now it is sam loco's turn . may his soul rip . #jhub
262006730223927296	26666548	negative	this nigga AT_USER just hit a full cou one handed shot with brook lopez ... smh , 21st bihday shit
